{
  "name": "outlook-mailer",
  "description": "Send emails via Microsoft Outlook on macOS using AppleScript. Supports recipients, CC/BCC, HTML body, and file attachments.",
  "version": "1.0.0",
  "type": "plugin",
  "author": {
    "name": "weirdapps"
  },
  "license": "MIT",
  "keywords": [
    "outlook",
    "email",
    "mailer",
    "applescript",
    "macos"
  ],
  "commands": "./commands"
}
